{
  "$schema": "../device.schema.json",
  "slug": "canary-display-touch169",
  "name": "Canary Nightstand Touch",
  "family": "canary-display",
  "board": {
    "mcu": "ESP32-S3",
    "psram_mb": 8,
    "flash_mb": 16,
    "board_id": "waveshare-esp32s3-touch-lcd169",
    "envs": [
      "canary-display-touch169"
    ]
  },
  "peripherals": [
    "display",
    "touch",
    "rtc",
    "imu",
    "battery",
    "backlight_pwm",
    "buzzer"
  ],
  "figure": "device.canary-display-touch169",
  "cad": {
    "scad": "docs/hardware/enclosure/canary_s3_touch169.scad",
    "enclosure_sets": [
      "1-69-touch-watch-display-puck"
    ],
    "params": {
      "glass_w": {
        "brd_fn": "brd_ws169_glass_h"
      },
      "glass_h": {
        "brd_fn": "brd_ws169_glass_w"
      },
      "glass_t": 2.6,
      "r_glass": 7.0,
      "aa_w": 32.634,
      "aa_h": 27.972,
      "pcb_w": {
        "brd": "ws169",
        "dim": "w"
      },
      "pcb_h": {
        "brd": "ws169",
        "dim": "l"
      },
      "pcb_t": {
        "brd": "ws169",
        "dim": "t"
      },
      "aa_dx": 0.0,
      "aa_dy": 0.0
    }
  },
  "emulator": {
    "flavor": "touch169"
  },
  "flasher": {
    "product": "securacv-canary-display-touch169"
  }
}
