{
  "$schema": "../device.schema.json",
  "slug": "canary-wap",
  "name": "Canary WAP",
  "family": "canary-wap",
  "board": {
    "mcu": "ESP32-S3",
    "psram_mb": 8,
    "flash_mb": 8,
    "board_id": "xiao-esp32s3-sense",
    "envs": [
      "canary-wap-default",
      "canary-wap-usbdrive"
    ]
  },
  "peripherals": [
    "camera",
    "microphone",
    "sd_card",
    "gnss_uart",
    "tamper_input"
  ],
  "figure": "device.canary-wap",
  "cad": {
    "scad": "docs/hardware/enclosure/canary_wap_enclosure.scad",
    "enclosure_sets": [
      "wap-compact",
      "wap-battery",
      "wap-weather",
      "wap-clip-coupon",
      "thermal-outdoor-kit"
    ],
    "params": {
      "board_l": {
        "brd": "xiao",
        "dim": "l"
      },
      "board_w": {
        "brd": "xiao",
        "dim": "w"
      },
      "board_h": 1.2,
      "board_clear": 0.6,
      "stack_camera": 11.4,
      "stack_plain": 4.5,
      "cam_lens_h": {
        "brd_fn": "brd_xiao_sense_cam_h"
      },
      "cam_dx": {
        "brd_fn": "brd_xiao_sense_cam_dx"
      },
      "cam_dy": {
        "brd_fn": "brd_xiao_sense_cam_dy"
      }
    }
  },
  "flasher": {
    "product": "securacv-canary-wap"
  }
}
